{
  "policy_version": 1,
  "id": "history-audit",
  "title": "History Audit",
  "description": "A review-oriented profile that scans every retained installed baseline transition and flags transitions that remove multiple skills or move bundle state too aggressively.",
  "defaults": {
    "latest_only": false
  },
  "thresholds": {
    "max_added_skills": 2,
    "max_removed_skills": 1,
    "max_changed_skills": 2,
    "max_added_bundles": 0,
    "max_removed_bundles": 0,
    "max_changed_bundles": 1,
    "max_installed_delta": 1,
    "max_bundle_delta": 0
  }
}
